<?xml version="1.0" encoding="UTF-8"?>
<r:SDPRules xmlns:r="http://www.sdp.com/SDPRules" 
            xmlns:xsi="http://www.w3.org/2001/XMLSchema-instance" 
            xsi:schemaLocation="http://www.sdp.com/SDPRules ../SDPRules.xsd ">

   <r:header>
      <title>Reglas de SQL</title>
      <replace>true</replace>
   </r:header>
   
   <r:group name="SQL">
      <idGroup>60</idGroup>
      <prefix>SQL</prefix>
      <r:title>
          <text>Calidad de SQL</text>      
      </r:title>

   </r:group>

</r:SDPRules>
