<?xml version="1.0" encoding="UTF-8"?>
<r:SDPRules xmlns:r="http://www.sdp.com/SDPRules" 
            xmlns:xsi="http://www.w3.org/2001/XMLSchema-instance" 
            xsi:schemaLocation="http://www.sdp.com/SDPRules ../SDPRules.xsd ">

   <r:header>
      <title>Reglas lexicas</title>
      <replace>true</replace>
   </r:header>
   
   <r:group name="LEX">
      <idGroup>10</idGroup>
      <prefix>LEX</prefix>
      <r:description>
          <text lang="xx">Analisis lexico</text>      
      </r:description>
      
      <r:item name="TAB">
         <object>TAB</object>
         <active>true</active>
         <r:title>
            <text>Caracteres de tabulacion</text>
         </r:title>
         <r:description>
            <text>
              El uso de caracteres de tabulacion puede ser dependiente del codigo de paginas usado
              Puede dar problemas de conversion ASCII/EBCDIC
            </text>
         </r:description>
         <r:message>
            <text>No usar caracteres de tabulacion</text>
         </r:message>
         
         <r:rule>
            <severity>2</severity>
            <condition>
               <property>exist()</property>
            </condition>            
         </r:rule>
      </r:item>

      <r:item name="HEXDATA">
         <object>HEX</object>
         <r:title>
            <text>Valores Hexadecimales</text>
         </r:title>
         
         <r:description>
            <text lang="xx">Usar la codificacion hexadecimal para los caracteres no imprimibles</text>
         </r:description>
         <r:message>
            <text>Usar la codificacion hexadecimal para los caracteres no imprimibles</text>
         </r:message>
            
         <r:rule>
            <severity>2</severity>
            <condition>
               <property>exist</property>
            </condition>            
            <sample>
               <description lang="xx">
                  El uso de caracteres no imprimibles:
                 
                  - Puede ocasionar problemas de conversion de caracteres entre maquinas
                  - Impide ver el codigo exacto que se esta utilizando
               
                  De manera general, cuando sea necesario utilizar caracteres especiales se deben especificar 
                  por sus valores hexadecimales
               </description>
               <correct>
                  01  NON-PRINTABLE.
                      03 TAB-CODE    PIC X(01) VALUE X'05'.           
               </correct>
               <bad>
                  01  NON-PRINTABLE.
                      03 TAB-CODE    PIC X(01) VALUE '\t'.           
               </bad>

            </sample>
         </r:rule>         
      </r:item>
   </r:group>

</r:SDPRules>
