<?xml version="1.0" encoding="UTF-8"?>
<r:SDPRules xmlns:r="http://www.sdp.com/SDPRules" 
            xmlns:xsi="http://www.w3.org/2001/XMLSchema-instance" 
            xsi:schemaLocation="http://www.sdp.com/SDPRules ../SDPRules.xsd ">

   <r:header>
      <title>Instrucciones</title>
      <replace>true</replace>
   </r:header>
   
   <r:group name="STMT">
      <idGroup>40</idGroup>
      <prefix>STM</prefix>
      <r:title>
          <text>Control de instrucciones</text>      
      </r:title>

      <r:description>
          <text>Control de instrucciones</text>      
      </r:description>
   </r:group>

</r:SDPRules>
