<?xml version="1.0" encoding="UTF-8"?>
<r:SDPRules xmlns:r="http://www.sdp.com/SDPRules" 
            xmlns:xsi="http://www.w3.org/2001/XMLSchema-instance" 
            xsi:schemaLocation="http://www.sdp.com/SDPRules ../SDPRules.xsd ">

   <r:header>
      <title>Reglas CICS</title>
      <replace>true</replace>
   </r:header>
   
   <r:group name="CICS">
      <idGroup>70</idGroup>
      <prefix>CIC</prefix>
      <r:title>
          <text>Calidad CICS</text>      
      </r:title>

   </r:group>

</r:SDPRules>
