<?xml version="1.0" encoding="UTF-8"?>
<r:SDPRules xmlns:r="http://www.sdp.com/SDPRules" 
            xmlns:xsi="http://www.w3.org/2001/XMLSchema-instance" 
            xsi:schemaLocation="http://www.sdp.com/SDPRules ../SDPRules.xsd ">

   <r:header>
      <title>Directivas de codigo</title>
      <replace>true</replace>
   </r:header>
   
   <r:group name="CBLDIR">
      <idGroup>42</idGroup>
      <idParent>40</idParent>
      <prefix>CBL</prefix>
      <r:title>
          <text lang="xx">Directivas de codigo</text>      
      </r:title>
      
      <r:item name="TRACE_DIRECTIVE">
         <object>STATEMENT</object>
         <active>true</active>
         <r:title>
            <text lang="xx">Directivas de codigo</text>      
         </r:title>
         <r:message>
            <text lang="xx">No usar directivas de traza</text>
         </r:message>
         
         <!--  Son logicamente excluyentes -->
         <r:rule name="ready">
            <priority>1</priority>
            <severity>3</severity>
            <condition>
               <value>READY</value>
            </condition>            
         </r:rule>

         <r:rule name="reset">
            <priority>1</priority>         
            <severity>3</severity>
            <condition>
               <value>RESET</value>
            </condition>            
         </r:rule>
         
      </r:item>

      <r:item name="REPLACE_DIRECTIVE">
         <object>STATEMENT</object>
         <active>true</active>
         <r:title>
            <text lang="xx">Directivas de codigo</text>      
         </r:title>
         <r:message>
            <text lang="xx">No usar macros replace</text>
         </r:message>
         
         <r:rule name="replace">
            <priority>1</priority>
            <severity>5</severity>
            <condition>
               <value>REPLACE</value>
            </condition>            
         </r:rule>

      </r:item>

   </r:group>

</r:SDPRules>
